{
  "schema_version": "2.0",
  "kind": "episode_content_inventory",
  "status": "completed",
  "input": {
    "audio_sha256": "6ceb37e1af33ff53e288afb654562d6fa19e8b72463cf8c8fac837132c199b32",
    "grounded_transcript_sha256": "2487f5940f503e0d24236e417b0f7b4ddb52e69610f9356f636293b2b07716c2",
    "corrections_sha256": "6afab690c3bf3671fea6e5cdfcbd83baab5ced35cabb1f8fd4ccd21bb9b2a0f4"
  },
  "evidence_anchors": [
    {
      "id": "ea_001_01",
      "source_kind": "grounded_span",
      "artifact_path": "00-source/transcript_grounded.json",
      "artifact_sha256": "2487f5940f503e0d24236e417b0f7b4ddb52e69610f9356f636293b2b07716c2",
      "locator": "clean_00058",
      "audio_sha256": "6ceb37e1af33ff53e288afb654562d6fa19e8b72463cf8c8fac837132c199b32",
      "start_ms": 135120,
      "end_ms": 136760,
      "raw_span_refs": [
        "raw_direct_00057"
      ],
      "excerpt": "为什么我们要点套餐呢",
      "support_role": "illustration"
    },
    {
      "id": "ea_001_02",
      "source_kind": "grounded_span",
      "artifact_path": "00-source/transcript_grounded.json",
      "artifact_sha256": "2487f5940f503e0d24236e417b0f7b4ddb52e69610f9356f636293b2b07716c2",
      "locator": "clean_00159",
      "audio_sha256": "6ceb37e1af33ff53e288afb654562d6fa19e8b72463cf8c8fac837132c199b32",
      "start_ms": 302740,
      "end_ms": 304260,
      "raw_span_refs": [
        "raw_direct_00158"
      ],
      "excerpt": "所以呢我就一口气",
      "support_role": "illustration"
    },
    {
      "id": "ea_001_03",
      "source_kind": "grounded_span",
      "artifact_path": "00-source/transcript_grounded.json",
      "artifact_sha256": "2487f5940f503e0d24236e417b0f7b4ddb52e69610f9356f636293b2b07716c2",
      "locator": "clean_00199",
      "audio_sha256": "6ceb37e1af33ff53e288afb654562d6fa19e8b72463cf8c8fac837132c199b32",
      "start_ms": 363060,
      "end_ms": 364160,
      "raw_span_refs": [
        "raw_direct_00198"
      ],
      "excerpt": "那我们今天的重点",
      "support_role": "context"
    },
    {
      "id": "ea_002_01",
      "source_kind": "grounded_span",
      "artifact_path": "00-source/transcript_grounded.json",
      "artifact_sha256": "2487f5940f503e0d24236e417b0f7b4ddb52e69610f9356f636293b2b07716c2",
      "locator": "clean_00339",
      "audio_sha256": "6ceb37e1af33ff53e288afb654562d6fa19e8b72463cf8c8fac837132c199b32",
      "start_ms": 600040,
      "end_ms": 601020,
      "raw_span_refs": [
        "raw_direct_00338"
      ],
      "excerpt": "他们的工作本身",
      "support_role": "direct"
    },
    {
      "id": "ea_002_02",
      "source_kind": "grounded_span",
      "artifact_path": "00-source/transcript_grounded.json",
      "artifact_sha256": "2487f5940f503e0d24236e417b0f7b4ddb52e69610f9356f636293b2b07716c2",
      "locator": "clean_00480",
      "audio_sha256": "6ceb37e1af33ff53e288afb654562d6fa19e8b72463cf8c8fac837132c199b32",
      "start_ms": 843820,
      "end_ms": 845420,
      "raw_span_refs": [
        "raw_direct_00479"
      ],
      "excerpt": "然后最后只能说",
      "support_role": "illustration"
    },
    {
      "id": "ea_002_03",
      "source_kind": "grounded_span",
      "artifact_path": "00-source/transcript_grounded.json",
      "artifact_sha256": "2487f5940f503e0d24236e417b0f7b4ddb52e69610f9356f636293b2b07716c2",
      "locator": "clean_00572",
      "audio_sha256": "6ceb37e1af33ff53e288afb654562d6fa19e8b72463cf8c8fac837132c199b32",
      "start_ms": 985760,
      "end_ms": 988600,
      "raw_span_refs": [
        "raw_direct_00571"
      ],
      "excerpt": "它给你带来了短暂的解压的作用",
      "support_role": "context"
    },
    {
      "id": "ea_003_01",
      "source_kind": "grounded_span",
      "artifact_path": "00-source/transcript_grounded.json",
      "artifact_sha256": "2487f5940f503e0d24236e417b0f7b4ddb52e69610f9356f636293b2b07716c2",
      "locator": "clean_00621",
      "audio_sha256": "6ceb37e1af33ff53e288afb654562d6fa19e8b72463cf8c8fac837132c199b32",
      "start_ms": 1078620,
      "end_ms": 1080740,
      "raw_span_refs": [
        "raw_direct_00620"
      ],
      "excerpt": "我害怕错过的心理",
      "support_role": "direct"
    },
    {
      "id": "ea_003_02",
      "source_kind": "grounded_span",
      "artifact_path": "00-source/transcript_grounded.json",
      "artifact_sha256": "2487f5940f503e0d24236e417b0f7b4ddb52e69610f9356f636293b2b07716c2",
      "locator": "clean_00812",
      "audio_sha256": "6ceb37e1af33ff53e288afb654562d6fa19e8b72463cf8c8fac837132c199b32",
      "start_ms": 1387520,
      "end_ms": 1388740,
      "raw_span_refs": [
        "raw_direct_00811"
      ],
      "excerpt": "然后比如说",
      "support_role": "illustration"
    },
    {
      "id": "ea_003_03",
      "source_kind": "grounded_span",
      "artifact_path": "00-source/transcript_grounded.json",
      "artifact_sha256": "2487f5940f503e0d24236e417b0f7b4ddb52e69610f9356f636293b2b07716c2",
      "locator": "clean_00974",
      "audio_sha256": "6ceb37e1af33ff53e288afb654562d6fa19e8b72463cf8c8fac837132c199b32",
      "start_ms": 1631080,
      "end_ms": 1632240,
      "raw_span_refs": [
        "raw_direct_00973"
      ],
      "excerpt": "请问后面的四个半小时",
      "support_role": "context"
    },
    {
      "id": "ea_003_04",
      "source_kind": "grounded_span",
      "artifact_path": "00-source/transcript_grounded.json",
      "artifact_sha256": "2487f5940f503e0d24236e417b0f7b4ddb52e69610f9356f636293b2b07716c2",
      "locator": "clean_01211",
      "audio_sha256": "6ceb37e1af33ff53e288afb654562d6fa19e8b72463cf8c8fac837132c199b32",
      "start_ms": 1973400,
      "end_ms": 1975120,
      "raw_span_refs": [
        "raw_direct_01210"
      ],
      "excerpt": "其实我们人生的ETF呢",
      "support_role": "context"
    },
    {
      "id": "ea_003_05",
      "source_kind": "grounded_span",
      "artifact_path": "00-source/transcript_grounded.json",
      "artifact_sha256": "2487f5940f503e0d24236e417b0f7b4ddb52e69610f9356f636293b2b07716c2",
      "locator": "clean_01109",
      "audio_sha256": "6ceb37e1af33ff53e288afb654562d6fa19e8b72463cf8c8fac837132c199b32",
      "start_ms": 1802700,
      "end_ms": 1804620,
      "raw_span_refs": [
        "raw_direct_01108"
      ],
      "excerpt": "它是以一个主题为基准来聚焦",
      "support_role": "context"
    },
    {
      "id": "ea_004_01",
      "source_kind": "grounded_span",
      "artifact_path": "00-source/transcript_grounded.json",
      "artifact_sha256": "2487f5940f503e0d24236e417b0f7b4ddb52e69610f9356f636293b2b07716c2",
      "locator": "clean_01260",
      "audio_sha256": "6ceb37e1af33ff53e288afb654562d6fa19e8b72463cf8c8fac837132c199b32",
      "start_ms": 2054100,
      "end_ms": 2056200,
      "raw_span_refs": [
        "raw_direct_01259"
      ],
      "excerpt": "饮食 睡眠和运动",
      "support_role": "direct"
    },
    {
      "id": "ea_004_02",
      "source_kind": "grounded_span",
      "artifact_path": "00-source/transcript_grounded.json",
      "artifact_sha256": "2487f5940f503e0d24236e417b0f7b4ddb52e69610f9356f636293b2b07716c2",
      "locator": "clean_01295",
      "audio_sha256": "6ceb37e1af33ff53e288afb654562d6fa19e8b72463cf8c8fac837132c199b32",
      "start_ms": 2098940,
      "end_ms": 2101460,
      "raw_span_refs": [
        "raw_direct_01294"
      ],
      "excerpt": "好 每天我们来做100个甩狐狸",
      "support_role": "illustration"
    },
    {
      "id": "ea_004_03",
      "source_kind": "grounded_span",
      "artifact_path": "00-source/transcript_grounded.json",
      "artifact_sha256": "2487f5940f503e0d24236e417b0f7b4ddb52e69610f9356f636293b2b07716c2",
      "locator": "clean_01380",
      "audio_sha256": "6ceb37e1af33ff53e288afb654562d6fa19e8b72463cf8c8fac837132c199b32",
      "start_ms": 2214520,
      "end_ms": 2218160,
      "raw_span_refs": [
        "raw_direct_01379"
      ],
      "excerpt": "75%以上的美国老年的骨质疏松症",
      "support_role": "context"
    },
    {
      "id": "ea_005_01",
      "source_kind": "grounded_span",
      "artifact_path": "00-source/transcript_grounded.json",
      "artifact_sha256": "2487f5940f503e0d24236e417b0f7b4ddb52e69610f9356f636293b2b07716c2",
      "locator": "clean_01724",
      "audio_sha256": "6ceb37e1af33ff53e288afb654562d6fa19e8b72463cf8c8fac837132c199b32",
      "start_ms": 2699600,
      "end_ms": 2701040,
      "raw_span_refs": [
        "raw_direct_01723"
      ],
      "excerpt": "只要它不干扰你的生活",
      "support_role": "direct"
    },
    {
      "id": "ea_005_02",
      "source_kind": "grounded_span",
      "artifact_path": "00-source/transcript_grounded.json",
      "artifact_sha256": "2487f5940f503e0d24236e417b0f7b4ddb52e69610f9356f636293b2b07716c2",
      "locator": "clean_01733",
      "audio_sha256": "6ceb37e1af33ff53e288afb654562d6fa19e8b72463cf8c8fac837132c199b32",
      "start_ms": 2709980,
      "end_ms": 2712000,
      "raw_span_refs": [
        "raw_direct_01732"
      ],
      "excerpt": "发展任务未完成的状态",
      "support_role": "direct"
    },
    {
      "id": "ea_005_03",
      "source_kind": "grounded_span",
      "artifact_path": "00-source/transcript_grounded.json",
      "artifact_sha256": "2487f5940f503e0d24236e417b0f7b4ddb52e69610f9356f636293b2b07716c2",
      "locator": "clean_01782",
      "audio_sha256": "6ceb37e1af33ff53e288afb654562d6fa19e8b72463cf8c8fac837132c199b32",
      "start_ms": 2786340,
      "end_ms": 2787500,
      "raw_span_refs": [
        "raw_direct_01781"
      ],
      "excerpt": "有一个理论认为",
      "support_role": "context"
    },
    {
      "id": "ea_006_01",
      "source_kind": "grounded_span",
      "artifact_path": "00-source/transcript_grounded.json",
      "artifact_sha256": "2487f5940f503e0d24236e417b0f7b4ddb52e69610f9356f636293b2b07716c2",
      "locator": "clean_02144",
      "audio_sha256": "6ceb37e1af33ff53e288afb654562d6fa19e8b72463cf8c8fac837132c199b32",
      "start_ms": 3295860,
      "end_ms": 3296900,
      "raw_span_refs": [
        "raw_direct_02143"
      ],
      "excerpt": "唯有在你自己出来",
      "support_role": "illustration"
    },
    {
      "id": "ea_006_02",
      "source_kind": "grounded_span",